{
  "format": "tv-remote-free-theme",
  "version": 1,
  "id": "builtin.sunset",
  "name": "Sunset",
  "author": "OpenRemote",
  "description": "Warm oranges, in light and dark.",
  "colors": { "seed": "#FF7043" },
  "light": { "background": "#FFF3E0", "ok": "#E64A19", "okText": "#FFFFFF" },
  "dark": { "background": "#1F1410", "ok": "#FF7043", "okText": "#1F1410" }
}
