{
  "format": "tv-remote-free-theme",
  "version": 1,
  "id": "builtin.retro",
  "name": "Retro Remote",
  "author": "TV Remote Free",
  "description": "Grey plastic, rounded rubber keys and a red power button.",
  "modes": ["light"],
  "light": {
    "seed": "#D32F2F",
    "background": "#CFCFCF",
    "surface": "#BDBDBD",
    "button": "#424242",
    "buttonIcon": "#FAFAFA",
    "accentButton": "#C62828",
    "accentButtonIcon": "#FFFFFF",
    "dpadRing": "#9E9E9E",
    "ok": "#C62828",
    "okText": "#FFFFFF"
  },
  "shape": { "button": "rounded", "cornerRadius": 12, "dpad": "rounded" }
}
